nlp_statements,ltl_formulas
Always provide users with an option to update their information.," ""G(!update_option -> allow)"""
Do not allow access to critical systems without clearance.," ""G(critical_system_access -> clearance_required)"""
Notify users if there are any issues with their accounts.," ""G(account_issues -> notify(users))"""
Always monitor for any unauthorized access attempts.," ""G(!unauthorized_access_attempt -> monitor)"""
Ensure that user permissions are regularly reviewed.," ""G(!permissions_reviewed -> review)"""
Notify users when their passwords are changed.," ""G(password_changed -> notify(users))"""
Users should not share their login credentials.," ""G(credentials_shared -> !allow)"""
Always provide an option for users to delete their accounts.," ""G(!account_deletion_option -> allow)"""
Do not allow changes to payment information without verification.," ""G(payment_info_change -> verify)"""
Notify users if their subscriptions are about to expire.," ""G(subscription_expiry -> notify(users))"""
Always maintain accurate records of user activity.," ""G(!activity_recorded -> maintain)"""
Ensure that all users complete the onboarding process.," ""G(!onboarding_complete -> complete)"""
Notify users about their account status.," ""G(account_status_change -> notify(users))"""
Users must receive confirmations for account changes.," ""G(account_change -> confirm(users))"""
Always provide an option to view privacy settings.," ""G(!privacy_settings_view -> allow)"""
Do not allow modifications to user roles without consent.," ""G(user_role_modification -> consent_required)"""
Notify users of upcoming training sessions.," ""G(training_session_upcoming -> notify(users))"""
Always ensure that the software complies with regulations.," ""G(!regulations_complied -> comply)"""
Ensure that all third-party applications are vetted.," ""G(!vetted_apps -> vet)"""
Notify users if their contact information is incorrect.," ""G(contact_info_incorrect -> notify(users))"""
Users should not disable automatic updates.," ""G(automatic_updates_disabled -> !allow)"""
Always log changes made to sensitive information.," ""G(sensitive_info_change -> log)"""
Ensure that all system notifications are clear.," ""G(!clear_notifications -> allow)"""
Notify users when they reach usage limits.," ""G(usage_limit_reached -> notify(users))"""
Users must acknowledge receipt of important communications.," ""G(important_communication -> acknowledge)"""
Always provide an option to view usage statistics.," ""G(!usage_statistics_view -> allow)"""
Do not allow changes to user profiles without verification.," ""G(user_profile_change -> verify)"""
Notify users when they have new alerts.," ""G(new_alerts -> notify(users))"""
Always enforce the policy of least privilege.," ""G(!least_privilege_enforced -> enforce)"""
Ensure that all users have unique identifiers.," ""G(!unique_identifier -> allow)"""
Notify users if their actions are restricted.," ""G(action_restricted -> notify(users))"""
Users should not be able to change the email associated with their accounts.," ""G(email_change -> !allow)"""
Always provide an option to report issues.," ""G(!issue_report_option -> allow)"""
Do not allow modifications to access controls without approval.," ""G(access_control_change -> approval_required)"""
Notify users when their files are uploaded successfully.," ""G(file_uploaded -> notify(users))"""
Always maintain backups of all configurations.," ""G(!config_backup -> maintain_backup)"""
Ensure that the system is compliant with security standards.," ""G(!security_standards_compliant -> comply)"""
Notify users when their devices are connected.," ""G(device_connected -> notify(users))"""
Users must agree to terms of use before accessing services.," ""G(!terms_agreed -> !allow)"""
Always provide clear guidance on system usage.," ""G(!guidance_provided -> provide)"""
Do not allow unauthorized changes to user settings.," ""G(user_setting_change -> !allow)"""
Notify users of changes in ownership of data.," ""G(data_ownership_change -> notify(users))"""
Always validate the source of data inputs.," ""G(data_input_source -> validate)"""
Ensure that all user actions are recorded.," ""G(!user_action_recorded -> record)"""
Notify users if they are at risk of data loss.," ""G(data_loss_risk -> notify(users))"""
Users should not disable security features on their accounts.," ""G(security_feature_disabled -> !allow)"""
Always provide options for restoring deleted data.," ""G(!data_restoration_option -> allow)"""
Do not allow sensitive data to be transmitted unencrypted.," ""G(sensitive_data_transmitted -> !allow)"""
Notify users when their requests are fulfilled.," ""G(request_fulfilled -> notify(users))"""
Always monitor for compliance with data protection regulations.," ""G(!compliance_monitored -> monitor)"""
Ensure that all user feedback is acted upon.," ""G(!feedback_actioned -> action)"""
Notify users if their sessions are about to time out.," ""G(session_timeout -> notify(users))"""
Users must provide consent for data collection.," ""G(!data_collection_consent -> !allow)"""
Always offer support for troubleshooting issues.," ""G(!support_offered -> allow)"""
Do not allow changes to system architecture without assessment.," ""G(system_architecture_change -> assessment_required)"""
Notify users when they are required to change their passwords.," ""G(password_change_required -> notify(users))"""
Always provide access to system audits.," ""G(!audit_access -> allow)"""
Ensure that all access to sensitive data is logged.," ""G(sensitive_data_access -> log)"""
Notify users about service outages in advance.," ""G(service_outage -> notify(users))"""
Users should not be able to override security settings.," ""G(security_setting_overridden -> !allow)"""
Always provide training on security best practices.," ""G(!security_training_provided -> provide)"""
Ensure that all employees understand the data handling policies.," ""G(!data_handling_policy_understood -> understand)"""
Notify users if their data is being processed.," ""G(data_processed -> notify(users))"""
Users must authenticate before accessing restricted areas.," ""G(restricted_area_access -> authenticate)"""
Always ensure that customer support is available.," ""G(!support_available -> provide)"""
Do not allow access to data without logging.," ""G(data_accessed -> log)"""
Notify users when they are granted new permissions.," ""G(new_permissions_granted -> notify(users))"""
Always provide clear information on how to escalate issues.," ""G(!escalation_info_provided -> provide)"""
Ensure that no unauthorized personnel have access to sensitive data.," ""G(unauthorized_access -> !allow)"""
Notify users about any updates to software they use.," ""G(software_update -> notify(users))"""
Users must agree to the privacy policy before registration.," ""G(!privacy_policy_agreed -> !allow)"""
Always provide a method for users to track their data.," ""G(!data_tracking_method -> provide)"""
Do not allow changes to user profiles without notification.," ""G(profile_change -> notify(users))"""
Notify users when there is a significant update in service.," ""G(significant_update -> notify(users))"""
Always maintain the integrity of user data.," ""G(!data_integrity -> maintain)"""
Ensure that all transactions are secure and verified.," ""G(!secure_transaction -> verify)"""
Notify users when they reach their account limits.," ""G(account_limit_reached -> notify(users))"""
Users should not be able to disable account recovery options.," ""G(account_recovery_disabled -> !allow)"""
Always provide training on how to use new features.," ""G(!new_feature_training_provided -> provide)"""
Do not allow unauthorized modifications to critical settings.," ""G(critical_setting_modified -> !allow)"""
Notify users if their data is shared with third parties.," ""G(data_shared_with_third_parties -> notify(users))"""
Always validate any external data sources.," ""G(external_data_source -> validate)"""
Ensure that all data backups are encrypted.," ""G(!encrypted_backup -> encrypt)"""
Notify users when changes to policies occur.," ""G(policy_change -> notify(users))"""
Users must confirm their identity when making changes.," ""G(change -> confirm_identity)"""
Always provide a method for users to give feedback.," ""G(!feedback_method -> allow)"""
Do not allow sharing of personal information without consent.," ""G(personal_info_shared -> !allow)"""
Notify users when system maintenance is scheduled.," ""G(system_maintenance_scheduled -> notify(users))"""
Ensure that all user requests are processed promptly.," ""G(!requests_processed -> process)"""
Notify users when their payment methods are updated.," ""G(payment_method_updated -> notify(users))"""
Users should not disable alerts for important notifications.," ""G(alerts_disabled -> !allow)"""
Always provide an option to view transaction history.," ""G(!transaction_history_view -> allow)"""
Do not allow changes to system configurations without approval.," ""G(system_configuration_change -> approval_required)"""
Notify users if their subscriptions are about to lapse.," ""G(subscription_lapse -> notify(users))"""
Always maintain logs of user activity for security purposes.," ""G(!user_activity_logged -> maintain)"""
Ensure that all system features are documented.," ""G(!features_documented -> document)"""
Notify users when their access permissions are changed.," ""G(access_permission_change -> notify(users))"""
Users must accept updates to terms of service.," ""G(!terms_accepted -> !allow)"""
Always provide users with access to training materials.," ""G(!training_materials_access -> allow)"""
Do not allow unauthorized access to sensitive data.," ""G(sensitive_data_accessed -> !allow)"""
Notify users of any service interruptions.," ""G(service_interruption -> notify(users))"""
Always ensure that users have unique identifiers.," ""G(!unique_identifier_required -> enforce)"""
Ensure that all changes to user roles are documented.," ""G(user_role_change -> document)"""
Notify users when their files are successfully shared.," ""G(file_shared_successfully -> notify(users))"""
Always provide an option for users to delete their data.," ""G(!data_deletion_option -> allow)"""
Do not allow access to sensitive files without proper clearance.," ""G(sensitive_file_access -> clearance_required)"""
Notify users when their requests are processed.," ""G(request_processed -> notify(users))"""
Ensure that user feedback is acted upon.," ""G(!feedback_actioned -> action)"""
Users should not be able to disable account recovery options.," ""G(account_recovery)"""
